{
  "$schema": "./schemas/mappings.schema.json",
  "schema": 1,
  "kind": "synex-compatibility-mappings",
  "identity": [],
  "accounts": [
    {
      "id": "qb.cash",
      "version": "2.0.0",
      "provider": "qb",
      "alias": "cash",
      "currencyCode": "usd",
      "accountKey": "cash",
      "accountRole": "asset",
      "minorUnit": 0,
      "legacyName": "cash",
      "label": "Cash",
      "round": true,
      "status": "PARTIAL",
      "fundingPolicy": { "kind": "deny", "accountRef": null },
      "sinkPolicy": { "kind": "deny", "accountRef": null }
    },
    {
      "id": "qb.bank",
      "version": "2.0.0",
      "provider": "qb",
      "alias": "bank",
      "currencyCode": "usd",
      "accountKey": "bank",
      "accountRole": "asset",
      "minorUnit": 0,
      "legacyName": "bank",
      "label": "Bank",
      "round": true,
      "status": "PARTIAL",
      "fundingPolicy": { "kind": "deny", "accountRef": null },
      "sinkPolicy": { "kind": "deny", "accountRef": null }
    },
    {
      "id": "qbx.cash",
      "version": "2.0.0",
      "provider": "qbx",
      "alias": "cash",
      "currencyCode": "usd",
      "accountKey": "cash",
      "accountRole": "asset",
      "minorUnit": 0,
      "legacyName": "cash",
      "label": "Cash",
      "round": true,
      "status": "PARTIAL",
      "fundingPolicy": { "kind": "deny", "accountRef": null },
      "sinkPolicy": { "kind": "deny", "accountRef": null }
    },
    {
      "id": "qbx.bank",
      "version": "2.0.0",
      "provider": "qbx",
      "alias": "bank",
      "currencyCode": "usd",
      "accountKey": "bank",
      "accountRole": "asset",
      "minorUnit": 0,
      "legacyName": "bank",
      "label": "Bank",
      "round": true,
      "status": "PARTIAL",
      "fundingPolicy": { "kind": "deny", "accountRef": null },
      "sinkPolicy": { "kind": "deny", "accountRef": null }
    },
    {
      "id": "esx.cash",
      "version": "2.0.0",
      "provider": "esx",
      "alias": "cash",
      "currencyCode": "usd",
      "accountKey": "cash",
      "accountRole": "asset",
      "minorUnit": 0,
      "legacyName": "money",
      "label": "Cash",
      "round": true,
      "status": "PARTIAL",
      "fundingPolicy": { "kind": "deny", "accountRef": null },
      "sinkPolicy": { "kind": "deny", "accountRef": null }
    },
    {
      "id": "esx.bank",
      "version": "2.0.0",
      "provider": "esx",
      "alias": "bank",
      "currencyCode": "usd",
      "accountKey": "bank",
      "accountRole": "asset",
      "minorUnit": 0,
      "legacyName": "bank",
      "label": "Bank",
      "round": true,
      "status": "PARTIAL",
      "fundingPolicy": { "kind": "deny", "accountRef": null },
      "sinkPolicy": { "kind": "deny", "accountRef": null }
    }
  ],
  "groups": [],
  "permissions": [],
  "metadata": [
    {
      "id": "qb.hunger",
      "version": "1.0.0",
      "provider": "qb",
      "key": "hunger",
      "valueType": "integer",
      "minimum": 0,
      "maximum": 100,
      "maxLength": null,
      "storageKey": "needs.hunger",
      "status": "PARTIAL",
      "sensitive": false
    },
    {
      "id": "qbx.hunger",
      "version": "1.0.0",
      "provider": "qbx",
      "key": "hunger",
      "valueType": "integer",
      "minimum": 0,
      "maximum": 100,
      "maxLength": null,
      "storageKey": "needs.hunger",
      "status": "PARTIAL",
      "sensitive": false
    },
    {
      "id": "esx.hunger",
      "version": "1.0.0",
      "provider": "esx",
      "key": "hunger",
      "valueType": "integer",
      "minimum": 0,
      "maximum": 100,
      "maxLength": null,
      "storageKey": "needs.hunger",
      "status": "PARTIAL",
      "sensitive": false
    }
  ],
  "forbiddenMetadataFields": [
    "access_token",
    "accounts",
    "balances",
    "bank",
    "capabilities",
    "cash",
    "character_id",
    "characterid",
    "discord",
    "fivem",
    "groups",
    "identifiers",
    "inventory",
    "ip",
    "license",
    "license2",
    "money",
    "password",
    "password_hash",
    "permissions",
    "refresh_token",
    "roles",
    "routingbucket",
    "session_id",
    "sessionid",
    "source",
    "source_generation",
    "steam",
    "token",
    "tokens",
    "user_id",
    "userid"
  ]
}
